{
  "schema_version": "1.0.0",
  "exchange_id": "fexc-20260901T172500000Z-a1b2c3d4",
  "origin_peer_id": "peer-a1b2c3d4e5f60718",
  "destination_peer_id": "peer-0000000000000001",
  "exchange_type": "OCI_BUNDLE_EXCHANGE",
  "skills_included": [
    {
      "skill_id": "react-modernization",
      "canonical_name": "react-modernization",
      "version": "1.0.0",
      "canonical_content_hash": "bc24db53a63843b745b43ecd75311238fbc99bf96dc8c7530677699b88521125",
      "provenance_id": "prov-v1-sha256:ed0c9e9aa5d0f876d3df240fbdaa858621b94762831402058c885faa23f981a1"
    }
  ],
  "manifest_digest": "sha256:596552cf11583365510fb13503394efd59e9769e01ab53da96342f0ce807f958",
  "signature_id": "osig-20260901T172500000Z-a1b2c3d4",
  "exchange_merkle_root": "596552cf11583365510fb13503394efd59e9769e01ab53da96342f0ce807f958",
  "timestamp_utc": "2026-09-01T17:25:00Z"
}
